"ReviewContent","ReviewDate"
"So I've stayed at this hotel one time with my girls for a birthday celebration. The rooms were clean and the views are beautiful but the lobby is the most breathe taking view in this building. Walking into the lobby feels like an indoor oasis, greenery and shrubbery every where, wooden logs piled up in a designated area, the main look of this hotel is upscale cabin chic. My main reason for always coming back is the lobby area, I use it as my workspace, meeting space, grabbing coffee with the girls or just bringing my family here for some quiet time, the security and front desk workers are always polite, even the crowd you run into here in this workspace are laid back and low key. If you're staying or just using the space you can grab a bite and neighbor coffee shop right on the first floor, they have an assortment of food and drinks, my go to are the lattes, smoothies and Avocado toast. The lobby lounge where you can grab Lucy and an early dinner, then you have the osprey am upscale farm to table restaurant and the food is always great (reservations are required). There's also a roof top Bar that you can listen to great music while you check out the view of the east river and the city skylines.","10/3/2022"
"I've stayed here twice this year, once in July 2022 and again in September 2022 and both stays were wonderful. I was a little worried at first seeing the reviews on Yelp which are much more critical than on Trip Advisor, but truly, we did not experience anything other than the most hospitable and accommodating service. The views here are amazing. The hotel is right alongside Brooklyn Bridge Park and you can easily walk to all of the piers. And of course, the view of the Brooklyn Bridge is just phenomenal, from the rooms, the rooftop bar, and from walking just a few feet from the hotel. I was able to stay in the Bridge View rooms on the 10th floor and they were amazing! Those rooms, however, are the ones with the clear shower doors, so just a heads up if you're staying with someone you wouldn't feel THAT comfy with. Everyone working here was incredibly friendly and helpful. And valet was very easy and quick for us. During my first stay here, my fiance actually was planning his proposal, and the front desk team not only helped him find a location outside but worked with him to find an even better room for us (which got us to the 10th floor). And because of this, I ended up bringing my Mom here to visit. During this 2nd time, I had actually booked a huge suite thinking another family member was staying with us, and it had been a pay-now/non-refundable room. I was so upset when the family member could no longer go with us, but the reservations folks and the front desk allowed me to downgrade my room and gave me a refund after a few short emails back and forth. The hotel is a little hippy dippy and they focus on recycle and reuse. The metal decor can be a little rusty but apart from this the rooms were clean and comfortable. We thought the food at the Osprey was decent (the parmesan fries are amazing though) but would definitely recommend going into Brooklyn or the city for good cuisine. Some places right near the hotel were great as well like % Arabica and Butler for coffee and pastries, La Bagel Delight a little further out had excellent bagels, and the Brooklyn Ice Cream Factory had awesome ice cream.","9/24/2022"
"If you want to be cheated and treated like garbage,I recommend 1Hotel Brooklyn bridge. This is how our story begins. We live in New York and we planned to celebrate our anniversary in a hotel with a view and pool. The only thing we needed was a nice view and a rest at the pool. We arrived at the hotel at 4:30pm (check in at 4pm) and we were informed that our room was not ready and to come back in half an hour. We waited in front of the hotel for half an hour and after that we finally got to the room we paid for one night. ($890 at the end $1377.67 included just 2 warm drinks, a glass of beer and a mimosa cocktail at the pool the next day). The only person who welcomed us for the whole time at the hotel and wasn't rude was the guy at the front desk. After we left our stuff in the room, we wanted to spend an hour and a half at the pool, which was supposed to be open until 7pm. We arrived at the pool at 5:20pm, the weather was beautiful and one of the employees ( a very rude girl ) told us that the pool was closed because of ""potential rain"" and with the sarcastic words ""safety first"", she turned and left.  What does it mean? Has anyone taught employees to welcome guests or they just know how to say ''safety first'' and don't know what the context is? Since it was hot, we went to the room to wait for the night to enjoy the rooftop. We went to the rooftop as hotel guests at 9:30pm. We sat at a table that was free and after 5 minutes an employee girl ( extremely rude ) came without any question but said that we had to get up because people were waiting to sit at the table. We said that we are guests of the hotel, that we are celebrating our anniversary and politely asked if we could sit anywhere and enjoy ourselves. She said that all tables are reserved and we could just walk around. We found a place to stand, but after half an hour the same rude girl came back to us to tell us there was a group of people who wanted to stand in that place and that we should move 6ft away from them. I need to point out that we were under constant pressure which did not stop during our stay in the hotel. When people started to leave the rooftop at 11:45pm, we sat down at a table to finally take a selfie for our anniversary. There was a lamp on the table that gave light and immediately an employee came to us who moved our phone, took the lamp, told us that the rooftop is closed and we need to leave. We stood up without saying a word and at that moment I saw a man with a beard who I assume is the manager and told him we are the hotel guests who celebrate our anniversary and how the employees are treating us. He had no comment other than ""sorry"".  After that, we went down to the 10th floor to the hotel bar and finally sat down at a table. After that, a manager with a beard appeared with a coworker and told us to go back to the rooftop to take a photo for our anniversary. Thanks but after the whole night of pressure from the horrible employees, we wanted to finally be at the table and spend some time without pressure. The next morning we went to the pool to finally see the pool and enjoy the view. At the entrance was the hostess who just watched us without any welcome and asked if we were guests of the hotel. She saw that we had hotel slippers and towels.  She cheekily said that we can only spend 2 hours at the pool.  We ordered 2 drinks for which we waited 30 minutes. After 30min I decide to ask pool stuff what's going on with our drinks, than be surprised by a group of 4 employees from the pool ( hostess, two guys and one girl ) who jokingly commented on the appearance of the girl who was in the wedding hall with the friends that she is ""ugly and fat"".   After that, a warm beer and a hot cocktail arrived.  The story does not end there. We went to our room after spending two hours at the pool and fell asleep. I will point out that the window in the room is terribly dirty and you cannot enjoy the view shown on the website. I received a call at 1:30 that a late check out of $250 was applied and that we had to leave the hotel immediately. They applied 10 times taxes witch you can see on the photo I posted with this review. After 20 minutes we left the hotel and I will remember this hotel as the worst experience I had in New York.  Along with the worst experience, you can see the bill I paid for the worst night ever in New York. As a positive side, I will praise the guy at the front desk and the staff at the bar on the 10th floor. We did not feel pressure at that bar. Summary: - Room - very dirty window, scratches furniture. - Rooftop - Warm drinks ( minimum 15$ ) , horrible service, rude and unprofessional employees. - Pool - Rude and unprofessional employees, horrible service. - Front Desk - Only staff members who will maybe welcome you. - Bar 10th floor - Good","8/28/2022"
"Right off the Brooklyn bridge park, this hotel is a delight. The lobby is beautiful and luxurious. There is a coffee shop that serves some good coffee and some finger food. The spa is one level below the lobby. Location is just perfect for anyone looking for some R&R","12/19/2022"
"Things started out poorly at check-in. Chaotic, valet took our bags and forgot our extra coats, I grabbed them and walked into the lobby to put them on the cart. A short female desk clerk, spotted me from behind the desk and yelled across the lobby, say 30-40 feet: ""Stay back! I cannot help you until I help this guest."" She pointed to a guy across the lobby fishing through a diaper bag for something. She then pointed to a spot on the floor and said"" You wait here"". Unbelievable, no ""Welcome to the hotel""..""Good to see you""... ""Thanks for coming""..just rude. I wasn't happy with this hotel choice to begin with and left it to my wife to finish check in. Decor: it's like the This End Up, furniture company from the 90's, was commissioned for this effort. Room lighting: the dimmest I've ever experienced. We had to use our cell phone lights to navigate the room at night. Location: fantastic.","12/23/2022"
"We ended up very disappointed with our stay. I notified the property manager and got an apology email but this was unacceptable and I wouldn't recommend spending the money. Please see the attached photos of our disgusting mattress cover and just a sample of the dirt we found in the room. I also notified them that our balcony door was coming off the tracking and difficult to open and close. To top things off, we realized that my daughter left a pair of shoes in the room, and when we went back to retrieve them, we were met with a very unhappy front desk person who added to the poor experience and service. The property is beautiful and in a great location, so If you are ok with spending the money despite the lack of detail or care, it may be worth it. Just take your own linen.","6/30/2022"
"This is a nice hotel . However the beds are super small. I stayed there for a night and I had to leave because it was a best friends trip and the rooms are super tight . It's great if it is only 1 person. Full size beds are a bust. The front desk staff were kind and polite .","12/3/2022"
"I would honestly rate this higher if I could. The location is amazing nestled walking distance to the Brooklyn bridge. So many restaurants that you can walk right over to. The interior of this hotel is amazing. Its the perfect mix of bringing outdoors indoors. The views from every angle of this hotel are amazing!. Super pleased with the front desk staff that assisted during our stay - unfortunately a door broke in the bathroom and they were so quick to provide a solution which the outcome was one night stay for free in a suite. Looking forward to staying again in the near future. If you book here make sure you head to the rooftop for a drink around sunset I promise you won't regret it.","1/6/2022"
"Let me start by saying that this is an absolutely beautiful hotel.  From the cozy lobby, to the scenic rooftop, to the bar with the terrific views, to the stunning modern rooms.  The pictures don't do it justice. So why 1 star then? The reason is that all night long I listened to the twang of elevator cables.  Probably due to the construction of the building (lots of concrete to make it look modern), i was constantly woken up all night long by this twang.  It wasn't super loud, but it was loud enough to be annoying and wake me multiple times.  I was in room 423.  I am telling you that in case you decide to stay there.  If you get this room immediately request a different room.  If you don't then pack ear plugs or your night will be ruined like mine was.  In the morning when i checked out, i told the staff that and their response was ""ok, we'll note a complaint"".  The room was $900 after taxes.  I would expect a little more than that.  Like maybe let me get a manager so you can discuss this with them or ""i'm so sorry to hear that"" or a variety of other responses.  But the person at the desk didn't seem to care and I had to run to catch my flight so I just left without making a fuss.  I suppose that was my mistake.  Lesson learned.","12/6/2021"
"The worst rooftop not worth the hype full of tourists overpriced drink that come in plastic glass and btw you pay 30% tip even if you don't want to it's already billed in your check. Nop not coming back","10/9/2022"
"We stayed at the 1 Hotel Central Park but decided to stop off in Brooklyn for drinks - Such beautiful views of the Brooklyn Bridge and Manhattan. Both hotels are trendy, with an emphasis on plants and the environment. The rooftop bar is a great spot to stop for a drink - Definitely pricey but the views are unmatched. They have a small food menu with a good selection of drinks. The outdoor rooftop bar is closed during the winter - they temporarily move it indoors to the floor below!","12/29/2021"
"Omg I am SHOCKED to see such low reviews on this incredible place. This hotel is my favorite place to stay  EVER (And I've stayed in many nice places around the world). I can't express the joy I feel when I walk into this hotel... it is STUNNING and the staff are such kind, welcoming people! Every time I'm in NYC I try to spend at least 1 night here because it is perfectly situated right on the water, surrounded by a park and with the most AMAZING views of Manhattan. For my birthday last year they upgraded my room to face the Brooklyn Bridge and I just about died... the rooms even have a full floor to ceiling window/door that opens up! If you're thinking about treating yourself to a nice place in Brooklyn, look no further! This is where you want to stay- walkable to everything, beautiful views, good food, easy uber/lyft pick up, etc. I love you 1 Hotel! Thank you for always making me feel at home during my travels :)","10/29/2021"
"We are return customers and stayed 4 nights recently. I give the hotel appearance, rooms, and staff a 5 star, very nice that is why we came back! HOWEVER the internet in our room did not work. We spent 2 days trying to get it going, and had efforts and interruptions to our work and stay as a result. Ultimately, after check out and leaving a note with our concerns, I get a voice mail from a Manager ""Alicia"" and wants to discuss. She leaves the ""general Hotel"" call back, so that was no fun...I tried calling back the next day, she was off. They put me to her VM and I was disconnected. Needless to say, one only has so much time. I guess Alicia was not concerned enough to call me back, or leave a direct contact in the first place. In summary, that part of the Hotel gets a ""zero"" so the average is a 2.5 score, well I rounded down in this case.","10/15/2022"
"Huge plus: accessible rooftop to the public. Incredible view of the entire city skyline as well as an impressive downstairs lobby. The upstairs bar tender was super nice. Wow--this place screams customer service. Definitely took my out-of-towners here to enjoy New York City. They had an incredible time.","9/17/2021"
"Dear 1 Hotel BB, I'm in love with you. I want to live inside you forever. BIG, HUGE shout out to James, DK, Tommy, and I'm forgetting a few more names here for the INCREDIBLE experience y'all gave me. You all deserve a hearty raise! I don't think I'll ever be able stay anywhere else when I come to NYC, even if it is a bit of a trip from Manhattan. The vibes, the experience, the room, everything was a dream. See you very, very soon!","5/25/2022"
"The rooms are beautiful. Amazing decor, great location. However--the service is really lacking. It has a very corporate, impersonal feel, kind of like a Vegas casino hotel. More importantly: I took this trip to NYC with a friend who is non-binary and from a small town where they don't feel comfortable being out. This evening they were sitting on the shared balcony, in a dress (fully covered), reading a book quietly, alone, minding their business and not talking to anyone. Another guest saw them through the window and called security on them without saying anything to us first. Security came and told my friend they had to go inside because they were making people uncomfortable. I understand that the hotel can't predict and ban transphobic guests, but I'm incredibly disappointed that their security team chose to handle it that way. And for that reason, I'd hesitate to stay here again, even though it's very pretty. In short: beautiful building and nice location, but inhospitable on multiple levels.","7/15/2021"
"What a location! The view of the Brooklyn Bridge is incredible and I would highly suggest getting the bridgeview room. It is worth the extra money. Everything about the hotel is top class and I love it here.  The location is also 2nd to none with a bunch of nice restaurants in the area and a lot to see.  Walking the BK bridge and promenade is essential and you will thank me later. I am from the area and I was still impressed! The rooms are very modern and spotless. I really like the filtered water fountain which was very convenient. The bed was also very comfy.  The other surprise was the window opens completely like a door so you can see the view. There is a railing there if you are worried abour safety. This is a pricey hotel but it is worth it.  FYI, the valet is $45 a day.  The service is spot on too with everyone being extremely helpful. I highly recommend.","12/10/2020"
"Beautiful hotel and view, however service is atrocious. Left us waiting hours for our car, our room, and room service. Never greeted us. General manager guy just walking around not doing a thing to see if we need assistance. Lady came and banged on our door at 10AM asking if we were going to leave; checkout as is at 12PM. For the money please go elsewhere. Never booking with 1 hotels ever again. Hali was the girl who checked us in; on her phone the entire time and did not care. Room 908.","2/20/2022"
"This is a beautiful boutique hotel, I'm giving it a 4 star rating because only after I made my reservation did I learn the rooftop bar & pool was closed for guests d/t a private event.  I was on the 9th floor & my room w/ a bridge view was exactly the NY experience I was looking for.  Rain shower head,","6/28/2021"
"This location is God-sent. Wonderful views, huge park, a ferry one minute away, etc. But I believe the staff is not well-trained here. Therefore, they are unable to provide high-class services in accordance with their prices. And the fact that some reviewers mention seeing badbugs in their rooms, just ends any more questions about whether to stay here or not until they completely change their untrainable team and management.","8/29/2022"
"Service was excellent. Everything else not worth the hype. The rooms though aesthetically pleasing lack functionality.","8/23/2022"
"Worn out rooms scratches on the walls, on the mirror on the glass. staff should learn some manners you pay extra for a room with a front view but i didn't got it and no money back also.","11/6/2022"
"Very nice rooftop bar - the views are stunning and the cocktail menu is inventive. I got a reposado espresso martini and appreciated the double upper :) it had me feeling v good lol. A great vibe without feeling pretentious.","12/5/2021"
"The restaurant and spa area and general aesthetic is beautiful. I was in a larger room but not the largest, the room had a cute concept and was on a top floor but it was a little too dated for me. It also takes an engineer to figure out how to use the shower. The hotel is a little too ""hipster"" for me. I personally don't want to reuse my towel after I shower, that's gross. I just want my clean towels,sheets etc every day and I want bottled water not tap.","7/4/2022"
"I came here on Halloween when they waived the minimum drink spend, but it was still $20 to come up to the bar. The views are beautiful - especially at night. You have a great view of the southern tip of Manhattan and the Brooklyn bridge. I didn't really enjoy my time here because you had to pay $100 extra to go behind a rope where people were dancing with the DJ - my $20 ticket just got me access to the bar and part of the views. The music wasn't music you could dance to","11/7/2021"
"Great location if you are looking to explore Brooklyn- located in the DUMBO area it was a nice home base for a few days. The lobby has a beautiful seating area, the concierge was awesome with useful recommendations. The roof top has a lovely view but is VERY young for who is there, I would say a cocktail before you head out if you wanted to grab a sun set up there or a night cap on your way in for the night. Not a place to hang out if you are over 30. The bathrooms are not super private. they are open to the rooms with frosted glass , so they give a semblance of privacy but you can hear every single thing, not to mention if you are there with friends and not a significant other be prepared to not be shy in the shower. you have little privacy, can see your whole outline and more .  Be cool and dont break the rules with thinking you can take a professional camera on top of the roof (this is not allowed, cell phones are fine) and just use your cell phone camera like everyone else. When we checked in there was a client was going nuts screaming at how much he was spending and wanted to use his professional camera on the roof- well tough buddy - there is a reason, not sure what it is but there is one.  Staff was great , rooms were clean and a little larger than i expected for NYC.","10/3/2022"
"My husband and I travel frequently and when we do we like to stay at top rate hotels. We recently had a blast in Williamsburg, so we decided to try the 1 Hotel Brooklyn Bridge. Our choice was an intelligent one. The 1 Hotel is very hip, and very well run. The rooms are beautiful, the lobby is grand, the pool is great, and the rooftop bar is spectacular. We glided in and out without any malfunctions at all. Our concierge helped us avoid any hiccups. Don't hesitate to go, and don't forget your American Express Centurion card. 1 hotel may not be for everyone, but it is certainly for me.","9/6/2021"
"The hotel itself is gorgeous! However the food at the restaurant/bar is HORRIBLE. It is supposed to be an asian-like cuisine. My noodles were dry and when i asked for hot sauce or soy sauce they had neither. The caesar salads do not even taste right. Lastly, the price is astronomical for no apparent reason!","4/5/2022"
"Room AC broken and took 3 calls to get someone up. We returned to find our room door propped open. Both Harriet's rooftop and the ground floor cafe got our orders significantly wrong and took multiple attempts to correct them. It should be noted both places were not busy when this happened. There is still a used tea bag from a previous guest on the floor of our room. I've emailed multiple people on the website and called down for help, but no response has come. If the hotel is reading this, we are in 709 until tomorrow.  Please fix it.","6/10/2021"
"I'll give a 2 for the views and the decor/style.  Service is incredibly bad.  Focus seems to be on instragramable moments rather an actual experience.  The people who work there are nice and just don't seem to know any better.  Whatever values they're trying to portray, they are failing miserably as they appear messy and leave no desire to return.","2/6/2022"
"Amazing hotel room and food!  Can't say enough about this place. Unfortunately have to cut the rating down because of being misinformed at the front desk upon check in and dealing with an uninterested customer service rep after the fact. Make sure you know what you are being charged for before handing your credit card over. They don't explain any charges without specific questions and will take advantage without any proper explanation as they believe their staff is ""properly trained"".","3/23/2022"
"Wedding night ruined. My (now) husband decided to surprise me on our wedding night and book a room at 1 Hotel - a hotel I've always wanted to stay. He called in the morning to confirm the room and ask for a bottle of champagne to be there when we arrived. After checking in, we walked into our room to find that they put us in a room with two double beds instead of the King room we purchased. We went downstairs, still in my wedding dress and him in his suit to talk to the front desk. They said there was nothing they could do and that they overbooked the hotel that night and it was the only room available without downgrading us to a smaller room without a view. We stood there just in awe of the fact that even with calling ahead and confirming they were aware it was for our wedding night, they still had the audacity to give our room away and think it was acceptable to give us a room with two beds. They did offer to refund us half, which was nice. But it still doesn't make up for the fact that one is the most important nights of our lives will always have a damper on it at the end because the people at 1 Hotel didn't have the common courtesy to accommodate somebody's reservation on such an important night.","10/13/2021"
"I had the pleasure of recently booking a private dinner on the 10th floor, catered by the Osprey restaurant. Everything from the food, the killer view, and atmosphere, to the bend over backward service provided by Laura Brown and her team, was awesome. I can't wait to return and book another event!","10/7/2019"
