"ReviewContent","ReviewDate"
"I see many reviews are for the rooftop, so let me preface the review by saying: I stayed in a room during my short staycation. Hotel: Amazing! Very eco-friendly and beautiful design. The hotel provides beautiful work spaces, amazing rooms, great staff (in person vs over the phone, more about that later), and, yes, a nice rooftop with views. Concept: In a word, ""green"". Wood, stone, and small mini-plant/moss garden in the room. I have not figured out the purpose of the ""Now/Not now"" stone, though. Room: Dumbo King. Airy and somewhat calming. My room did not have a tub, but there is a separate toilet and shower. They are separated by a frosted glass wall. The floors are cement in all of the bathroom areas. The shower gel, soap, and lotions are nice as well. Not too perfumey. There is an esteamer, yoga mat, free slipper socks (to take!), and a cozy daybead and comfy flexible lounger. The bed is very comfortable, and at least 72 in. x 76 in. The lighting and A/C are controlled by the iPad docked near the bed. There are multiple lighting combinations to play around with. There is also the option to set a ""red"" privacy light and a ""green"" service light outside the door for housekeeping. There was a partial view of the east river and Brooklyn Bridge from the room, the rest was the other side of Furman street. No bluetooth speaker(s)!!!, though. Rooftop bar: Nice views, but the atmosphere and crowd were not really my scene. Techno, alcohol, unnecessarily loud conversations... I will just say no one would mistake it for a charity fundraiser. Those not staying in the hotel have to wait downstairs in a queue that is roped off. Visualize that, does it sound familiar? Then you have an idea of the rooftop atmosphere. To be fair, I only went at night, and not the next morning/afternoon. Location: Brooklyn Heights waterfront. So, yes. Service: I had a great experience face-to-face with all staff members. Very friendly and helpful. The text service was also adequate during my stay. Service over the phone leaves a lot to be desired. I had a feeling the person ""assisting"" me wanted to do everything else but that. What not 5 stars? Two reasons: 1. No bluetooth speaker(s)!!! and 2. I was overcharged for an in-room snack (took one item, was charged for two). That is not really a big deal, but it does point to a lack of detail by the turndown staff since either I was just erroneously charged during inventory, or it was taken by a prior guest, and not replaced or reported. Overall: Worth the stay. Beautiful and natural, great views, and a wonderful staff.","9/6/2017"
"I am a big fan of the 1 hotel properties.  Stay at the Miami location several times.  Actually we were of of the first few guests when they opened.  Celebrated birthdays and anniversaries there. Spend sometime at the one in Brooklyn during April to celebrate my daughter's birthday.  Today we tried celebrating my next daughter's birthday and it was a mess.  First room 504 air was not working. They did not tell us anything and we had the balloons and everything out.  The cake was melting that's how warm the room was so they told us they will move us to 904. The air worked in the bedroom only.  Finally they said the whole line for that side was not working.  No a word from a manager or anyone else.  I want to give a huge and grateful acknowledgment to Davis who helped us with our bags and everything.  He has the best attitude.  So positive and kind.  I was ready to move my daughter to another hotel and David made me change my mind with his positive words.  Thank you David.  You are awesome.","6/1/2021"
"My boyfriend & I spent our staycation/birthday celebration here. The rooftop view is captivating and the service we received was wonderful. Upon arrival the concierge asked what brought us to Brooklyn (we live in the tristate) and once I exclaimed my birthday was the next day a large smile grew on her face. As we were getting ready to head out to dinner our bell rang and it was a bottle of champagne compliments of the desk. We are both freshly 23 (in other words, we aren't high rollers) so balling out on their common king suite with no special view was a stretch for us, and the fact that they still went above and beyond was THE best feeling. The rooms are stellar & even after check out they were able to hold our bags while we spent a few hours on the roof. The french fries ... ORDER THEM any chance you get!! They're amazing!","9/3/2017"
"I am staying here right now and am  so thrilled with the entire venue. From the smiley reception ,the great cafe,the exquisite suite with unsurpassable views including a hammock in the suite overlooking the Brooklyn Bridge skyline water and Statue of Liberty.  This is a  jewel in the making!!    Brand new but  so much potential to be a true front runner in the burgeoning Brooklyn hotel scene.  When the spa. and fine dining restaurant open this will be as close to perfection as one can hope for!! I am the pickiest of critics and can say this is one of my most wonderful fun experiences.  The entire surrounding area adds to the enhancement I simply CANNOT wait to return. A perfect stacation or for a vacation they really get it","2/26/2017"
"I have stayed at other 1Hotels and this by far is the worst! You would think the brand would hold integrity throughout the franchise but I was proven wrong time and time again. Let's start with the pool reservations, the email that was sent three days before I checked in stated that if I wanted to reserve a time for the pool to do so via the link provided or via the App. Also the reservations weren't open to hotel guests until the night before at 7pm. When the link and App did not work, I called the front desk where I was told that reservations were completely booked for my entire stay and reservations for the pool were made 14 days prior to the dates selected. I was then told to email the concierge who then told me the same thing. To top it off the concierge's email was very dismissive. Secondly the initial room that I was assigned faced public urinals when I paid for a premium room facing the Brooklyn Bridge. When they moved me they gave me a room with a better view however smaller than what I paid for. They eventually moved me to a better room the next night however when I left for the day in the early afternoon I left the service light on and it was not serviced on my return 3 hours later. I tried calling housekeeping but the line was busy. I reached out to the front desk and they replied that housekeeping left for the day but they will try to find someone to service the room. I went down to the front desk and they told me they would send someone right away. Two hours later they still didn't send anyone. I had to request again for service and then they finally came 7 hours later after the  initial request!! The straw that broke the camel's back was the next morning, the hot water decided that it didn't want to come on. At this point, I was done. I can not believe how poorly this hotel is run and the lack of communication between departments. You guys failed tremendously and I left disappointed with the 1Hotel brand.","9/7/2021"
"We cannot say enough great things about 1 Hotel Brooklyn Bridge! Me and my now fiancé visited 1 hotel at the beginning of March. Little did I know our staycation was actually my engagement night! The staff at 1 Hotel was so amazing to my fiancé and upgraded us to a suite to make our stay so special! The setting paired with the room was a dream! The staff was so happy to congratulate and accommodate us. I couldn't ask for a better way to say yes to the man of my dreams!!","10/29/2020"
"Luxurious Hotel with an amazing rooftop frautring breathtaking views of all of Manhattan. Expensive but worth it. They have great parties with awesome artists and a pool on the roof too.","6/8/2019"
"I recently stayed here on a staycation during Memorial Day weekend and it was a very nice experience. The room was cozy and comfy but, I do wish they would supply room slippers for your stay for the price that a room costs. The view from our room was ok. We could see part of the Brooklyn Bridge and the rest of the view was the building across the street. The service at the hotel is great. I think that made up for not having room slippers available. LOL!! This hotel has an amazing view of the city skyline from the pool area and the pool is pretty big (for NYC standards) to. If you're looking for a hotel then stay here as it's conveniently located in Dumbo and has easy access to Manhattan. You'll love it.","5/29/2019"
"Words can't express how nice this hotel is. The staff are very welcoming, professional and nice, they get 10 plus stars. The rooms are very nice and clean. You would really have to experience it yourself because I'm speechless. The view of the Brooklyn Bridge from the roof top is simply gorgeous.. I think this is one of the best hotels that I have stayed in all around 5 stars and more.","11/24/2018"
"The 1 Hotel Brooklyn Bridge is an incredible experience. I live in New York City and recently took a staycation here in the summer and loved every minute of it. The 1 is like no other hotel and after you leave, you will feel refreshed and relaxed. The Pool: extremely private, excessive service to ensure you're hydrated and fed. Incredible city views and no shortage of furniture to lay out in the sun or in the shade. The Restaurants: The Osprey for dinner was a magical experience, it did not feel like I was in the city. It's surrounded by nature and steps from the Brooklyn Bridge. The cafe is also great for a quick morning coffee or snack. The Room: waking up to a view of the Brooklyn Bridge was surreal. The shower and shower products are an experience themselves! The room was extremely clean and the bed was very comfortable. The Staff: incredibly friendly and accommodating This was my second stay at the 1 and I would absolutely do it over and over again.","7/29/2019"
"Firstly, I really like the location and the view is amazing. Drinks are always tasty and whether you are in the lounge, or the rooftop bar, the atmosphere suits the setting. We sat in the lounge because we were told it was a $50 minimum spend to sit on some couches on the rooftop. This is a bit silly but the message was passed onto us in a non offensive manner. The server in the lounge was friendly enough and the drinks came out quite quickly due to it being fairly empty. I feel that they provided the right level of service without getting too much in the way. Its not stand out amazing service, but its pretty much what you need it to be.","7/28/2019"
"I absolutely love this place!!!! I found this hotel trying to find a place to stay in New York.  I decided on this Brooklyn hotel because it was close to the airport and close enough to manhattan and for the price, a great choice to stay in a good hotel. When I arrived, my expectations were far exceeded. This place is beyond cool, cozy, clean, fun and upbeat. Truly beautiful design, great value, amazing room with an incredible room and better than all this, THE service is exceptional!! from the front desk, bell hop, door man to the restaurant the staff here is on point!!! I will definitely be back and I will definitely try their hotel in Miami and manhattan purely based on how great this stay was. I'm in the room and thoroughly enjoying my room.","11/13/2018"
"I spent the night here with my sorority sisters in celebration of our anniversary.  The staff was amazing and extremely helpful and accommodating.  Sabine and David were not only professional and friendly, they provided great customer service and made our stay perfect!  We could not have asked for more.","4/12/2021"
"My husband and I had the most amazing experience at 1HBB.  Strongly recommend for couples who need some weekend getaway. Hotel staff were friendly and efficient, great service at the rooftop pool (even at 90+ degrees). Get the truffle fries! Couples massage at the Bamford Haybarn Spa was perfection! Friendly service at the Osprey, dinner was delicious with great choices.  We sat outside at night with the summer breeze, it was so romantic.  We will come back for the cocktail ""All Hans on Deck"" for sure! The view of our room facing the Brooklyn Bridge is incredible.  We stared out our wide opened window all day and night, listened to the sounds and fell in love with NY all over again.","7/21/2019"
"This rooftop bar view will not disappoint! I am a cocktail snob, but the bartenders could dip me in pool water and then pour it to me, for all I am concerned, and I would still come back to lounge and soak in the view of Manhattan AND the Brooklyn Bridge. 10/10 must bring out of town guests here if not for a photo opp with that backdrop. The chill vibes and drink selection was very reminiscent of Roosevelt hotel in the City, however in reading other reviews it seems that the staff might not be as hospitable, unfortunately, if looking for somewhere to stay.  I find this hard to believe, because all staff at The Osprey, the downstairs restaurant, were above and beyond nice, considering their busy pace.  The 1 Hotel rates are comparable, so I will have to try to stay here in the future so as to debunk or confirm this suspicion personally. As of now I remain unbiased and look forward to this opportunity.","5/31/2018"
"My boyfriend and I took a weekend trip here and were so excited based on the views and the appeal of the location. Upon arrival we spoke with the concierge who kindly took our temperatures and offered hand sanitizer to us. However, this gentleman was not informed about the valet parking offer this hotel provides which at first alarmed us due to the high cost of parking in the area but we were able to receive our free valet parking after speaking with another informed member of the team, Remy. Check in was perfect, Remt offered us suggestions for our day, and was able to get us set up with our room package which came with specialty chocolates, French macarons, and a bottle of Prosecco! Upon entering our room our view was of an empty apartment building across the way... of course if you turned your head and bent your body a bit you could get a glance of the bridge but we had spent so much money on the room, that we really were paying for the view and had not received that. With a hotel that is occupying very minimal guests due to covid restrictions, we would've thought that the guests would've gotten prime room views. My boyfriend went down just to make a kind request at changing our room, and Remy was one again so thoughtful and immediately provided us with a new room of the most exceptional and unobstructed view! The windows were so amazing, that we didn't hear a thing outside which was great. We loved being in such close proximity to the whole downtown area too! The room was immaculate with the exception of some heavy rust stains by the bathroom faucet, but otherwise I could not have drawn up a more gorgeous room! The attention to detail was superb and we felt so safe and comfortable during our stay! We were so pleased with how comfortable and modern and eco-friendly the entire hotel was! The digital room thermostat was amazing and we noticed any time we got warm or cold, that the second we utilized that tool, the room instantly became more comfortable. The shower was unreal as well, the water pressure was amazing and to be able to shower with a view of that city and bridge was top notch (even the lotion, body soap, and shampoo/conditioner were excellent)! The rooftop bar is no longer available for use due to restrictions but it is available for use as an observation deck which was so great! The beds were pretty firm, but that's to be expected at most hotels. Overall, our stay was excellent and I cannot wait to return to 1 Hotel, and even check out more of their offered locations!","2/22/2021"
"The rooftop bar is worth the visit.  I met up with some friends for a few drinks; we ordered some food as well, basically hot dogs and burgers, which were fine, but nothing to write home (or yelp) about.  The views and atmosphere, though, were great.  I highly recommend checking it out.","6/2/2018"
"Discovered that the lobby of this hotel is a great place to hang out, order a drink, and enjoy the nice ambiance. After taking a ferry ride to the area, we were at a loss for what to do with our time til the Brooklyn Heights Social Club opened up at 5pm, but it turned out that the lobby was the perfect option! The staff was extremely warm and friendly the whole time, even though we were just squatters and not full-on hotel guests, which I appreciated! We were able to order drinks and cocktails and enjoy them there even though the upstairs bar wasn't open yet. Turns out we weren't able to end up going to the Social Club for drinks because we had a baby with us and they had a rule against baby strollers (or babies in general), but I couldn't hold it against them too much because I could understand that some people might not want kids and babies running around while they enjoyed their high end cocktails and the view of the BK Bridge. Based on the service I'd recommend the hotel to friends looking for a place to stay in the area, and I'll definitely be back to hang and get a drink.","3/21/2018"
"We paid over $2k for the room to have our wedding weekend photoshoot and reveal and on the day of the shoot we are told that we need some special photo document filled out to take photos and do the reveal in the hotel. Well, no body mentioned this when i was booking and we specifically told them we want a wedding photo shoot within the hotel property. Would not recommend at all! And, they've lost a loyal customer because I've staid there before but never again. The food in the Osprey was mediocre and the lady at the front who told us we cant take photos was rude and uncaring she did not provide alternatives. If you want a good experience go elsewhere! I have to add, the suite we booked had awesome views but the room layout was really weird...the bedroom and living room where not separated bu a door but by a wall and the shower is in public view so you don't get much privacy. If not for the inattentive concierge and us not being able to take photos i would have given 4 stars .... but on my big day they could have come up with something other than a ""no"". Never again and would never recommend to anyone!","6/8/2021"
"Overall, the hotel has nice facilities - rooms, bathrooms, and was overall very clean. The location is also great, as it is close to many restaurants, and has a great view of the bridge. Was not as impressed with the hotel's service capabilities. Requests for coffee refills (for the nespresso machine), extra towels, etc. went missed, and requests were granted often the next day but never immediately. Also stayed for NYE, and was told that there would be complimentary hot chocolate on the roof... however went to the roof and it was not available -I think that sums up the stay.","1/1/2021"
"****Reviewing the BARS only, have not stayed at the actual hotel**** This is one of a handful of my go to spots, especially in the summer.  There are really 3 bars in one here.  First is on the ground level with an inside/outside patio bar with beer, wine and a light menu readily available.  Im not a huge live music guy but they do a great job with keeping the music adding to the experience rather than taking away from it. Next they have a great atrium style full bar inside with super high ceilings, couches, etc. Lasty there is a rooftop bar with very little bro activity. The view form the bar is quite possibly the best view of lower manhattan I've personally come across. You can see several bridges, and all the iconic buildings. Being up there for sunset is fantastic.","6/1/2018"
"Some of the staff where nice others where not and make you feel almost as if your kind doesn't belong there at the entrance a security before I even got through the door asked me what's name on the reservations as if he was even the clerk who was going to assist me & check me in how ever the clerk at the front desk was very warning and nice gave me no problems and treated me very kind and laughed with me .... the room was nice I like the eco friendly vibes in the rooms the view was nice ... now my problem was at the rooftop pool when we went to great the person who does the reservations he looked at me like what are you doing here told me it wouldn't happened with me going to the pool because so many people where on the waiting list them I offered him money & all of a sudden he found me chairs to sit on , how ever the next day he stared me down and told me I told u to be here at 6:30 am & I gave u chairs yesterday ! In a very rude tone as if HE DID ME A FAVOR ... LIKE IM NOT THERE WASTING MY MONEY OR LIKE MAYBE SINCE IM A HISPANIC WOMAN OF COLOR MY MONEY HAS NO VALUE .... I SEEN HIM ACT VERY DIFFERENT TOWARDS PEOPLE WHO WHERE WHITE AND HOW NICE AND WELCOMING GE WAS TO THEM.... MY QUESTION IS ARE YOU THE ONE WORKING HERE OR ME ? THAT YOURE TREATING ME AS A PEASANT ? I DONT CARE HOW NICE THE VIEWS WHERE IVE NEVER BEEN TO A HOTEL WHERE STAFF MEMBER MAKE U FEE TOTALY AWKWARD LIKE YOUR KIND DOESNT BELONG THERE ITS TRULY SICKENING..... I won't ever go back there.","7/28/2020"
"Beautiful view, beautiful cocktails, super polite and friendly service! They stay out of your way for most of the time unless you need them, and the pricing isn't blown out of proportion for a Brooklyn rooftop bar with beautiful city views. It's a wonderful place to take friends and family, and is especially nice on a summer day/evening and a great place to have in pocket when thinking of rooftop bars to go to in the area. Their lobby is also SO aesthetic, we were in love!! Great job, 1 Brooklyn hotel!","12/15/2018"
"On the road for work 220+ days a year for the last 10+ years and I'm thinking this is the best hotel I've ever stayed in. Rooms, view, bed were all amazing bu those things are easy to get right. The cumulative effect of all the little things was what made this hotel great. The wooden RFID room keys instead of the standard plastic ones. Filtered water tap in the rooms built into a nook in the wall. Glassware in room was beautiful. Concrete floors in bathroom with no ledge into shower or toilet. Refillable soap and shampoo containers. The in room couch and table were perfect. Floor to ceiling window across the whole wall. Free EV parking and charging. Tesla X courtesy car. Customer service was better than anywhere I have seen before. We stayed one night and they knew my name and face. Food was great. Upstairs bar was beautifully done with views of the whole city but didn't feel too vibed out like the Standard rooftop bar. Kiki at reception and Wes at the porter desk both looked genuinely happy to be there and talk to the guest. The lack of being right in Manhattan was made up for ten fold by the great customer service.","11/5/2019"
"Romantic, modern, city vibes atmosphere. Good music, great guac dip. Pool is small but ok. Awesome view to the Brooklyn bridge and parts of the city line. I don't recommend their coffee, ugh, it was awful. Decoration was beautiful and relaxing. Make sure to get there earlier than check in time if you have other plans, check in gets very busy and might have to wait at the lobby for awhile for about 1-2 hours.","10/30/2019"
"Gorgeous views of manhattan skyline, and the Brooklyn Bridge.  Rooms are green and  so interesting.  Filtered  water in each room Which is great. Would absolutely stay here again.  The garden on the 10th floor is outside with heat lamps. The views can not be beat.","1/27/2019"
"This hotel is absolutely lovely!!! Everything about it the views, rooms, decor, restaurant, rooftop bar, and staff.  Would be happy to come back and stay here anytime.  It is worth the price and the location is perfect!!! Definitely one of my favorite hotels and it's located in one of my favorite places!","8/4/2018"
"Upon arrival I was told by the stellar front desk team (whom also recommended a FANTASTIC restaurant for a late bite since we checked in around 10pm) that my room had been upgraded. I had mentioned in my booking that I was visiting to celebrate my birthday, but wasn't expecting to be upgraded to a room with one of the best views in the hotel! The surprises didn't stop there - in the room I discovered a handwritten birthday note along with a travel-sized bottle of botanical pillow mist! The room is super eco-friendly, cozy, and clean; offers filtered tap water, cozy knit socks, a yoga mat, and the bed is so comfy! An iPad will help you discover the area and is also your way of contacting the front desk. The views cannot be beat either. With a floor-to-ceiling sliding window we had a perfect view of the Brooklyn Bridge and NYC skyline. The rooftop pool offers sweeping views from water to skyline to the Statue of Liberty, but get there early as chairs will fill up quick. The hotel also comped our second round of drinks due to a computer glitch that delayed our food delivery. This hotel goes above & beyond and is a must-stay in Brooklyn.","9/27/2020"
