"ReviewContent","ReviewDate"
"The hotel is beautiful, interior design is incredible and you cannot beat the views/location. But, their staff/unorganized manner dampened our experience quite a bit. A few things to note (capacity is due to Covid-19): 1. If you want to spend time at the pool- you have to get up at 6:30am, so you can be in line at 6:45 to make a reservation for lounge chairs (you will need a reservation to use a lounge chair at any time during the day). If you don't have a reservation, you CAN still swim, but the max capacity in the pool area is 35 people and there are 20 chairs. So only 15 people without chairs can be around at any given time. BUT- if you schmooze and love up to the guys running the pool area- you'll have a better chance of getting in.. not a good system. 2. People are allowed to reserve multiple time slots at the pool. So, one group can be around the pool for 6 hours- while others staying at the hotel may not be able to swim at all.. 3. If you want to even sit in the rooftop area- they require you to spend $50 per person, not a big deal if you plan to eat and drink. Well.. it was $50 per person one time we asked, then it was $75 per person, then it was $100 per person.. even if you're staying at the hotel. There didn't seem to be any actual rules set and the price changes seemed very random. The hotel staff definitely play favorites and if you're staying in a suite or spending ""enough"" money your experience will 100% be wonderful, they will bend over backward for you. But, if you're just in a typical room (like we were), don't plan on them going out of their way to help you. At one point, as we stood in line hoping to get into the pool, a hotel employee came up to the employee in charge of the pool area and said ""make sure this group gets anything they need, we want them to have a great experience""- referring to a completely different group than the ones that had been patiently standing in line trying to access the pool all day. That's not something I would ever suggest staff say in front of other guests. Don't get me wrong, we were able to enjoy our time at the hotel. We did end up being able to spend time at the pool and enjoy the atmosphere, we just really had to figure out the system to make it happen.","8/2/2020"
"Booked this hotel for a staycation for 2 nights and 3 days. Summary of pros. There were a couple of good pros in the sense that they had limited capacity at the pool area (due to social distancing measures) and cleaned the lounges every 2 hours. The room we had was very clean and loved the views. The staff was friendly- nothing too out of the ordinary. There was a restaurant and a coffee shop at the lower floor which was great for any late night munchies and/or breakfast treats. We were able to bring up food to the pool area so that was great. Pros listed: - Social distancing was pretty standard - Everyone wore masks - Staff was friendly - TV had chrome cast/bluetooth capabilities - Rooms were very clean - Rooftop was wonderful Summary of cons. Okay- so for the most part and as a travel/leisure industry trying to work out the kinks of operating during a pandemic, it was overall a good experience. However, I had to take 1 star off due to the following reasons: Cons listed: - Hotel never told you that you had to reserve lounge chairs for the pool area. Guests can stay in the pool for as long as they want but if you want to reserve a lounge chair you'll have to go before 7 AM to do so. Each reservation is only for 2 hours. - In order for you to stay at the rooftop area (even as a guest) you would have to spend at least $50. My friend and I were spoken to by the hostess and the waiters/waitresses for sitting in the area for about 10 minutes while we waited for the pool staff to clean the lounge area. MIND YOU. There would be no one at the pool and they would be asking you to not sit there and that they have ""reserved"" tables. Okay... I know this is complete BS and you're just trying to get us to spend more money to make up for the pandemic but seriously? You're trying to nickel and dime your hotel guests that are already paying AT LEAST $400 per night? Overall- it's okay whatever.","8/4/2020"
"They charged my credit card for an amount they are not supposed to do over $600 and  if I didn't check my bank account they will never tell me. I am really upset with this situation.","12/2/2020"
"3 stars for the views. We loved 1 hotel in Central Park so much we decided to change our Airbnb in Brooklyn to the 1 hotel Brooklyn bridge... we had high hopes. Unfortunately restaurant was rude & did not treat us like guests at the hotel we ended up leaving after 25 minutes of being unattended or greeting at our table. Staff was not friendly throughout the hotel. Again views were AMAZING. In a great location! Quick walk to so many restaurants.","11/1/2020"
"This is the best rooftop bar view in all of New York City. Verily, the sights of the bridges, East river, the skyline and the street below are a sight to behold. As to the bar itself: really nice! Its trendy with a restaurant, and a pool area for reserved parties and guests. The space for regular patrons isn't the biggest but its enough. What really surprised me was how chill the environment was. A hotel like this could easily charge a cover, or mandate a dress code. Surprisingly, it wasn't at all pretentious: diverse crowd with people wearing what they like. Moreover, the drinks were made well, I enjoyed my dark and stormy. Only issue is that the drinks are pricey, but understandable considering its a hotel of this capacity and pricing. This place was pretty sweet, I would go back.","8/12/2017"
"One word: STUNNING. If you're a hotel guest: Stayed overnight and the views were amazing. There is a sliding door to open up for fresh air and view the city/bridge. The rooms have many bathroom amenities and different lighting settings. Besides the usual robes/soaps, they also have makeup mirror lighting, cotton swabs and shower caps- oh and we had a hammock! Absolutely loved that the lobby by the elevators had baskets of fresh fruits and lemonade. Rooftop: Everyone has access to the rooftop. Drinks are on point and all refreshing especially Summer Supply which is watermelon and tequila. Need I say more? Pool: Only hotel guests have access to the pool but if you are one, please make a quick stop here before leaving! The water is warm, views are awesome and you can order drinks whether in the pool or getting your tan game on. They also have free cucumber/lemon infused water.","8/31/2019"
"Nice place to hangout and drinks. Enjoyed the Broklyn bridge and Manhattan city view. $20/ Each to enter the rooftop.","8/17/2019"
"I loved this hotel. If possible I would rent one of the rooms to live in. Once I'm ready to purchase a house or condo, I'm going to instruct the designer to make it exactly like the Liberty Rooms in 1 Hotel Brooklyn Bridge. After staying here two times, I'm going to wholeheartedly say that Hotel 1 Brooklyn Bridge is my favorite hotel to this date! Another awesome perk for guests that I have to mention is that if you need to commute within 3 miles of the hotel, you can get a free ride in the hotel's Tesla. The ride alone in a $90K+ Tesla is an experience on it's on. If you're staying here, take advantage of it. Location: 5/5 The hotel is right on the water and affords AMAZING views of the Manhattan Skyline. There's a bunch of restaurants in walking distance including Shake Shack and a solid pizzeria. Decor: 6/5 I stayed in the Liberty King room and pretty much fell in love. It was modern with USB plugs, super functional and just the industrial style I like. Cleanliness: 5/5 Pristine. Super clean and swanky. Service: 5/5 All the staff is top notch. I've never run into any of the cleaning staff but the front desk staff are friendly and accommodating. I've even gotten a complimentary upgrade on my first stay here. Hotel Amenities: 5/5 Everything is nice and brand spanking new. The industrial yet natural and green (environmentally friendly) style flows throughout the entire decor of the hotel. Even the elevators are swanky. The Rooftop Bar: 5/5 The rooftop deserves a review on its on. It affords an even better view than the liberty rooms. You can see the Statue of Liberty and get a really great panoramic picture of the NYC skyline. Price: 5/5 Expensive but worth it! Especially if your company is fronting the bill. :-) ... In all honesty though, the price is comparable to similar high-end hotels in the area and in city.","8/9/2017"
"Probably the best rooftop view in Brooklyn. Their cocktails are hit or miss though. At $17 a pop, I expected them not to be served in plastic cups, and for them to actually put some effort into the presentation. The Smash was the better of the two cocktails I tried. The other was the Poolside, which lacked any punch. Waitstaff was amazing. They went out of their way to accommodate our large group by moving chairs around. Wish there was more umbrella covering though, as half our group was sweating bullets with the sun directly above us at mid-day. Didn't try much of the food, but did sample the fried mochi bites, which was definitely unique. They also do more substantial things like a $25 lobster roll, $14 burger, or $8 hot dog. So basically, 5 stars for the views and staff. And 3 stars for the bar program.","8/14/2017"
"My boyfriend and I are celebrating my birthday over the Labor Day weekend. We booked Brooklyn bridge view for 2 nights. After we get our room, it's water view (at a lower price which is around $200 less than the room we booked) Manager said the card was declined the first time when we booked the room. when they tried again, no more bridge view room available. First of all, we didn't know that before we come. Second and most importantly, if we don't mention we got the wrong room, hotel didn't mention it at all when we checked in, and we are paying 2 nights bridge view rate. They agreed to refund the difference for the first night, and move us to bridge view room on the second day. Shouldn't they mention that when we check in?! Plus, we mentioned it's my birthday. They didn't say anything about this mistake or anything for the birthday. Usually hotels at the price range, I'm expecting something like a happy birthday card at least. My friend got a complimentary upgrade for her birthday ( not even on the exact day ) when we went to palm spring. Anyway, very disappointed and will not come back again","9/3/2021"
"I am a resident of Brooklyn; therefore, it stands to reason I will most likely not require a stay at this gorgeous hotel. HOWEVER, I have visited the rooftop many times and hung out in the lobby and was always welcomed as though I were a visiting guest/tourist. The rooftop alone is worth a visit for nowhere else can you capture the beauty of the stunning bridges and the Manhattan skyline all lit and looking so dazzling. Great addition to Brooklyn Bridge Park. I am sure guests enjoy their stay here.","9/20/2017"
"This hotel has major problems. It is very poorly run and way overpriced for what you get in the way of services. And their bookkeeping is very screwed up. Be careful if you should stay there. To start out, when we got into our room, the air conditioning was malfunctioning. After two attempts, that finally got repaired. The room also had no wash cloths to use in the shower. And the room lighting left something to be desired. As to the bookkeeping issues, see below. My wife and I attended a wedding for a relative there on June 19th. And the groom's family had arranged to have all the billing for the room's stay as well as the fee for parking and other incidentals paid by them. When we checked in, we were told that all expenses had in fact, been taken care of by our family member. When we checked out, we were told that the hold on our credit card for incidentals had been released, and that no money was due. One week later, we came to discover that about $700. was in fact charged to our credit card. So be very careful when you get you bill from them. And good luck in terms of the facilities being properly maintained. I would not make that my first choice if I were going to be in the area in the future.","6/25/2021"
"JC the hotel manager was beyond helpful and accommodating. Looking forward to returning for another experience.","12/4/2021"
"Disclaimer: I DID NOT stay at this hotel, I only came for the rooftop. However, I would gladly stay at this hotel for the experience you'll have on the rooftop. To be honest, I saw this rooftop bar on Instagram and decided to give it a shot since the views looked absolutely stunning. When I got to the top I couldn't have been happier with my choice to try it out. Here's the rundown, be expected to wait in line at least 20 minutes on the ground floor if you're coming on a weekend night. I waited about 20 minutes after arriving around 7:30 on a Saturday evening in the summer. My friends who came about an hour later weren't so lucky. They waited about 40 minutes before trying a different entrance that allowed them to go up instantaneously. Once there you pretty much have uninterrupted views of the Brooklyn Bridge, downtown Manhattan and Brooklyn Bridge Park. The rooftop is encased in a glass enclosure which assures constant views even if your sitting away from the edge. Arriving almost right before the sunset almost assured that it would be crowded (which it was) but if you're strong enough to brave it until you're guaranteed to find a good spot on the enclosure to snap a picture without anyone in your way. The drink prices were reasonable too! All beers on tap were only $8 and the choices for cocktails were pretty extensive as well. This is a great place to come with friends who are visiting the city and want a good time without the craziness of a rooftop bar in Manhattan. Great customer service, wonderful atmosphere and beautiful views make this a must if you're looking for a good time in downtown Brooklyn.","7/31/2017"
"The hotel was definitely amazing. The ambiance. The view. The room was huge. The rooftop was beautiful. But what they lacked was customer service! We were given a room late. So as a courtesy the manager gave us a suite and let us check out late, which I think was great. But it's just probably communication with staff. They don't even let us know food are not gonna go up and we have to pick it from the lobby if we order delivery - I have to call them. And checking out,  we're supposed to check out late at 3pm because that's what they promised to us, but coming back to the room, they already removed our key access at 1pm. So we have to wait again for us to be accommodated and let us in.  ‍","7/30/2020"
"Had 2 good tasting drinks ,enjoyed the view and atmosphere then headed to our fav spot.","9/9/2020"
"This is the first hotel I've stayed in where I wouldn't mind staying inside the hotel the whole trip vs. exploring. They nailed their goal of bringing the outdoors inside with lush greenery everywhere.  The staff was super friendly and walked us to our room. They may have walked us up and stayed a little too long but such a minor detail. The room itself had a beautiful view of the Brooklyn Bridge and River. If you're staying here, you may as well pay a little more to get the view since it's amazing to wake up to. We stayed during December and I'm honestly dying to go back during the summer so we can take advantage of the rooftop and pool. Our room was clean and everything was so cozy from the bathrobes to the bed. I loved the use of moss instead of a plant in our bathroom. If you're looking to splurge on a weekend trip in NY this is the hotel to stay at. I believe there's 1 Hotel by Central park but I'd probably prefer to stay at this one.","1/12/2020"
"GLORIOUS... I've been hanging out at this hotel since its opening and I have nothing bad to say. First let's talk about the architecture and ambience...absolutely glorious! Whenever I want to get work done sometimes I come here and hang out in the space provided for the locals. This place is very neighborhood friendly. I've also been to the spa which you have to visit at least once. The restaurants here is pretty good and the different venues inside the hotel is good as well. The views and the customer service is so on point. The view alone is 10/10. One of the very few places in NYC that I don't mind doing a little staycation in.","1/26/2019"
"At the current time, as of October18, 2021, the hotel staff and patrons are not wearing masks in any of the indoor public spaces. They do not ask for proof of vaccination upon check in. Proof of vaccination is required for the gym, bar and restaurants. Rooms are very small. Room service menu very limited but it was fast. Aesthetically pleasing hotel. Bed was very comfortable. Good location in DUMBO. If they adhere to CDC indoor mask guidelines and ask for proof of vaccination upon check in I would raise the rating to 3 stars.","10/20/2021"
"This hotel is totally going downhill. The people at the front desk have attitude. They won't extend basic courtesies like phone chargers. It feels touristy and transient here. I would not go here if you're looking for something tranquil.","7/6/2021"
"We had a great stay here this weekend! There were a few glitches but the hotel handled it in a very professional manner and for that reason, I would recommend this hotel. The first night my husband and I stayed there, our neighbor through the wall was very drunk and very upset and kept us up all night yelling. We had to call the front desk at 3:15am to notify them about the noise and got no sleep. They sent up a security guard up to rectify the situation and it immediately stopped. In the morning we received a text from a woman named Mary apologizing for the noise and asking if there was anything she could do to make out stay more comfortable. I  really appreciate the customer service in this circumstance. While it was not the hotel's fault this woman was very loud that night, they proactively took responsibility for the issue. They were also very accommodating for our request for a late check out. Thank you!","9/8/2020"
"My husband and I always stay at the 1 hotel in Miami when we travel there. With many FL trips cancelled due to COVID, we traveled to the 1 Hotel Brooklyn Bridge location twice in the past month and a half. Upon our first stay, we were welcomed and taken care of by Robert at the front desk. I am HUGE on customer service and cannot rave more about the level of service and detail Rob provided during our stay. He always checked in to make sure we were ok and gave recommendations on where to eat in the area. Prior to us leaving during our first stay, we told Rob that we would hands down be back with our children to enjoy another great stay with the hotel and all of the amenities it had to offer. A few weeks later, we were back! It felt immediately like home! We had decided to come up a day earlier as our power was out at home due to the tropical storm that had come through. Upon our arrival, with lots of luggage, our three boys AND our puppy, we were taken care of. Now, you can imagine how stressful the few days prior had been with operating with no power at home with young children, puppy and bouncing around. The suite we had was phenomenal with the view of the BKLYN bridge, Manhattan AND Statue of Liberty! Our kids fell in love with the view and felt right at home - they even made friends at the rooftop pool on their first day! 1 Hotel is naturally a go-to for us now. A quick two hour drive and we feel like we're in paradise. I want to give a very special shout out to Rob for his graciousness, attention to detail and always making sure our family was ok during our stay. 1 Hotel IS home for us and we will be back time and time again!! More shout outs go out to the following: Korey! This man is so polite, patient and caring! He's always smiling and you can definitely tell he loves what he does! Larry and Yago: Everyday during our stay they made sure our family was OK while at the pool and let the kids stay in as long as they wanted, (Kids have to be kids, right!?) even when we weren't occupying pool chairs. Sebine: so kind, attentive and has an infectious smile!","8/17/2020"
"being a ""cool"" and ""trendy"" hotel does NOT make it okay to have terrible service. i would give this hotel 1 star if the location wasn't amazing. can't beat the views. however, the service here is terrible and you will feel like an inconvenience the staff if you make any requests. the service at this hotel is horrible and slow on top of that. we actually had a precious guests CLOTHES in our room when we checked in. then when we moved rooms due to numerous other issues (AC not working, windows wouldnt close, too noisy on our floor, TV not working etc) they packed that stranger's clothes into our zipped up and packed suitcases and sent them to our new room. also, the pool booking system is ridiculous and you'll be lucky to get a spot as it is tiny. but again, can't beat the views.","6/1/2021"
"Lovely place! Some what friendly staff! Love the fresh fruits by the elevator at the lobby!","8/17/2018"
"The place is exciting, the drinks, food and this amazing view is one hell of an experience....I was here with friends for a birthday party....","12/18/2019"
"I came here for drinks on the rooftop and I must say this place is gorgeous. The cocktails are expensive but they are nicely made. This is a great date spot as the view will be sure to impress. The bartenders were ""okay."" At one point he made us a specialty drinks and the glasses were only half full. We approached him about it and he seemed a bit annoyed that we were asking why a drink thats about $15 was only half way full. We could tell he didn't want to but he ended up filling the glasses up. I thought that was pretty rude as there was about 10 of us and we were definitely spending money. If you like tequila they have some aged bottles that you can take a shot from but be ready to pay the price. Overall this place is wonderful to have a nice drink and relax I would definitely come back in the summer. *side note: My friend had a room here for the night and the room was really nice. The view was spectacular and the building is very ecofriendly  just as Brooklyn Bridge Park is.","3/31/2018"
"I simply had one of the worst hospitality and service related incidents at the 1 Hotel that I can remember. I visited Harriet's (The Rooftop Bar), went to the bar, ordered a drink and started a tab. Shortly after, my friend made it to the bar as well and put a drink on my tab as well. We enjoyed them well enough and after some time  went to close out my tab. Here is where the problem started - There was no tab open any longer.... After searching for my card, we find out the bartender had somehow let some other (still unknown) person close out my tab, without confirming they were Alan (me), and even gave them my credit card. Already bad enough, it seemed the unknown card snatcher put additional drinks on the tab and put a $30 tip on the tab before closing and taking the card. I immediately called my credit card and canceled it and luckily no other charges made it on. The bartender apologized, promised me he'd void the check and even gave us a free drink to boot, but I had a feeling they check wouldn't actually be voided. I asked if he could produce the receipt and he told me ""its already been voided, you don't have to worry about it"". I insisted and he produced the paper receipt with the fraudulent signature. I snapped a picture and figured all ended up turning out okay with a decent story to leave with... until I checked my Chase account a week later and the full amount posted to my credit card - fraudulent drinks + tip and all. I called in immediately, gave hotel employee the backstory + details and she told me that only a manager could help me and they were ""on the floor"". She said to try back later.... I tried back later and same thing (she told me that only managers can decide when to take calls. To her effort she told me she'd leave a message and a manager would call me back. A day passes and nothing... I call back and its the same employee and this time they were able to track down a manager and she conveys that the manager promises me they'll call me back before end the day.... and nothing. Over a 10 day period this phone tag between me calling Hotel bar and the management team not calling me back, until eventually having to call and get my bank involved. To this day, ~a month later, not a single representative of the 1 Hotel has gotten back to me and I've now had to get my bank involved. I work in the travel industry and been to similar spots all around the world have never experience the lack of concern, urgency or care that the 1 Hotel Brooklyn Bridge showed. I'll never be back and would suggest you skip to the many other great hotels + rooftop bars in Brooklyn.","8/3/2019"
