"ReviewContent","ReviewDate"
"Stayed here for two nights - one was the night of my wedding, and one was the night before so I could get ready in the room with my bridesmaids. The location, views, and room itself are amazing, but the lack of service was surprising given the price and profile of the hotel. Key issues to watch out for: 1) Whenever I placed an order on the iPad to bring something up to the room (extra hangers, plastic bags, extra water cups), it would take so long that I would need to call down to follow up. In some cases, the items never even arrived. 2) My larger recommendation would be to work on team members' intonation on the phone. Two times when I called down (once to ask about the Tesla and once to ask about a speaker), the way they turned down my requests made me feel like I was stupid for even asking for those items. Instead of being apologetic that they could not fulfill the request, they gave the impression that I was inconveniencing them in some way. This left a sour taste in my mouth, especially since the 1 Hotel is a more high-end place where you would expect good service. 3) I got conflicting information from different people, which was unprofessional and disappointing. The day before I checked in, I spoke to the concierge about being able to check in early and getting a specific room. He told me the room number and said there was no problem. Day of, I call again to coordinate arrival, and someone else informs me that I cannot check in early and I cannot get the room they had promised. Again, the person was not apologetic about the issue and made me feel ridiculous for even expecting to have the particular room I was told I would have. It was stressful, disappointing, and confusing.","5/20/2018"
"I am so impressed by Megan Peabody, the hotels concierge and her wonderful assistance and follow up that I can honestly say I have not had service like this in quite some time.  Aside from being kind to help me find local services, she is articulate , professional and went above and beyond. She is exceptional and a great asset to your hotel!  Thanks again Megan and 1 Hotel","2/7/2018"
"This hotel is amazing!!! Great location, amazing service provided by wonderful staff. This review is two years overdue, but better late than never right? My fiancee proposed to me at this hotel in 2018, and the experience still makes me cry happy tears. My fiancee coordinated the whole surprise proposal with the staff. I had no clue. I had been working 80 hours a week and was a walking zombie for Valentine's Day weekend but I love my guy so much I was going to make every effort to enjoy our time together. From the time we entered the hotel and checked in, we were treated like royalty. The room was beautiful and the view of the Statue of Liberty and downtown Manhattan was just beautiful!!! My fiancee had arranged to have flowers, champagne and strawberries in the room. He proposed and then told me he had made dinner reservations at The River Cafe. He said it had been really difficult to get a table but the 1 Hotel staff was very helpful in making the reservation happen. When we returned to our room from dinner there were tealight candles and flower petals all over the room. How freaking romantic is that?! My fiancee had coordinated that with the staff as well.  And to top it off it started to snow so the view of the snow over the East River was freaking amazing!!! I could believe the staff also made the snow happen, LOL. It was just an amazing weekend all made possible by people who work hard to create an experience for their guests. Thank you!!! The memories will last a lifetime.","2/14/2020"
"This review is only for the rooftop bar and not the hotel. I'm keeping it very simple and straight to the point. Bartenders aren't friendly at all when you ask them for a suggestion about drinks. If you depend on tips be mindful to provide friendly and welcoming customer service. I happened to bumped into the supervisor, a very young guy and gave him a suggestion and he basically didn't care so I ended up giving them minimum tip. Providing good customer service can make a huge difference. I won't be going there again anytime soon.","7/4/2018"
"NEVER AGAIN, Went to the hotel bar, bought 2 drinks $16 and $13 adds up to $29 doesn't it?  WRONG. $38? so my husband payed cash. After using my first grade math skills of basic addition I questioned the bartender. Keep in mind their was no receipt or bill provided to us . Just the unkempt bartenders word. Once questioned, she then stated they add 15% gratuity to bills because ""tourists don:t know"" Whelp, We were not tourists being born and bred in Brooklyn yet she didn't know this. what if we were???? So you will steal our money AND insult the very people you are serving. And the cocktail didn't taste as good as the description, leading me to believe she put too little or too much of something. We will never be back and hope this review finds other guests, travelers, patrons, paying customers that just because YOU put 15% doesn't mean WE have to PAY IT. And hopefully people will learn and not fall for it. BTW I myself have worked as a server /Bartender in NYC my whole life. It is my profession, and this is just unprofessional. I hope those couple of bucks from us helped you. This experience ruined what was a great Saturdate with my husband. Good thing I am reading The Art of Not Giving A F@ck.","8/13/2019"
"Do not take your wedding party to this hotel. The bar closes at midnight and the walls of the rooms are too thin to even have normal conversation without complaints from neighboring rooms. The wedding party rooms should've been clustered together. And you had better stay there with a close friend because the shower walls are clear glass and the toilet stall has smoked glass but there is no privacy. The security people were overbearing and Omnipresent. Room service charges not only a gratuity but a delivery fee, adding much to the cost of the food and all from room service.","6/25/2017"
"This hotel is super nice and has amazing views of the Brooklyn Bridge and Manhattan skyline. However, I have stayed twice and both times had horrible service at the rooftop bar, the pool bar and the extremely overpriced restaurant on the main floor. We had to eat on the main floor (The Osprey) because one night of our stay, the entire rooftop bar was rented out the whole evening and guests were not allowed to go up. Also, both times I've stayed, check in has taken a long time and there has been something wrong with the room (broken shampoo bottles on shower floor once and a broken closet door which meant that the closet light was constantly on). Very pretty hotel but the service I've received doesn't match the price I've paid to stay.","5/31/2019"
"A litte dissappointed that this eco friendly hotel carries plastic in their coffee shop.","4/22/2018"
"Review is for the rooftop bar, which was great and had amazing views. Drinks were pricey, my avion and pineapple with lime cost $17 but with a view like theirs, you definitely won't be complaining too much. The staff were friendly and accommodating and made us feel welcome.","8/18/2017"
"The rooftop view is beautiful. And the hotel décor inside is beautiful. But I had a terrible experience with one BALD BARTENDER. I can't not say something. This guy charged me $15 more than what I had ordered and when I corrected him he charged me again for the correct amount but never refunded my money. I waited a few days thinking that it might show up later (I even tipped him more than 18% despite his bad attitude). A couple of days later, I called the hotel and spoke to the accounting department where I found out that this fucking asshole gave himself a 20% tip with the incorrect amount and never refunded my money. The hotel staff was really nice and understanding. They sent me an email with the receipt which showed how much he tipped himself and said they would refund me. BUT THEY DIDN'T. So, eventually, I just had to call my bank and dispute the charge. The whole thing was annoying. It wasn't only that I was charged too much but that I was charged twice, plus the asshole had the audacity to tip himself. My advice is, go there. It's a fun place with a beautiful view. but just be careful what they're charging you.","8/31/2017"
"I'm writing about the hotel room, not the rooftop bar, which was spectacular. We were there for a wedding, and experienced substantial delays in checking in.  No one would listen to us when I plead to be let into a dirty room, so I could shower and dress.  We were finally admitted with less than 1 hour to go before the ceremony at 5 pm. The room was architecturally interesting, but non-functional.  No ironing board in room.  The chair was painful to sit in (older adults with back or knee problems will hurt themselves).  The lighting was totally inadequate to see yourself to do your hair or makeup.  It took a hunt to find the blower-dryer, which is hidden in a basket to the left of the closet.  The only mirror is by the sink, so if you're sharing with another adult, expect to be crowded.  The bathroom walls are crystal clear, so you'll need to be on very good terms with your roommate...The bathrobe is made of material that looked like a repurposed old gray tracksuit. On the other hand, the bed was comfy.  Both of us got a robe, and there was fresh fruit available from 7 am to 7 pm near the elevator. The room had a nesspresso machine, but not a coffee pot.  I guess I'm too focused on comfort, instead of trendiness.","9/6/2017"
"Best hotel I've ever stayed at. Beautiful views, comfortable beds, and great amenities. Plus it's a green hotel! Recycling bins in each room, living plants everywhere, and environmentally friendly finishings throughout. It's majestic!","7/11/2018"
"One of my favorite hotel experiences. From the minute you enter you have to ask yourself .... can I afford this? This place looks too nice .... the decor and artwork... the trees hanging from the ceiling ! Remarkable and not found in any other hotels! DOGS!!! They allow dogs! No Extra fee? What! Amazing! Rooms are pricy but well worth it compared to other hotels. Finishes and linens are soft and Lux ! HIGHLY RECOMMEND","5/11/2018"
"If I could give this hotel a 10 Star I would. So deserving, great customer service from the entire staff. From the bellmen, front desk, cafe, restaurant and hotel roof top bar. Everyone was extremely pleasant, welcoming, and had a great attitude. The room was spectacular, view stunning and such an amazing stay. I highly recommend the Brooklyn 1 hotel as a home away from home stay. Will definitely be coming back and staying for future travels.","7/5/2018"
"Quality hotel for the price. Stunned by NYC views in December even as a native NY! Stayed overnight and upon checkout realized I forgot an item while waiting for valet, after surrendering keys. Quickly teamed up with security and they brought me upstairs to retrieve my item. Very professional staff.","12/18/2019"
"This is undoubtedly the most beautiful view in all of New York. Very friendly staff, and great food option. Also a very hip and laid back hotel while maintaining professionalism.","11/18/2019"
"This property fires on all cylinders.  The design and architecture of this hotel alone are a reason to stay, eat and drink here, not to mention the view, the vibe, the quality of the staff, the experience!  I mean, world class from tip to tail!  Also, their eco friendly mission aligns with my goals, which is also a plus.  An absolute gem!  I can not wait to explore their other properties.","9/26/2018"
"This Roof top bar has amazing views of Manhattan and Brooklyn Bridge, also a really good interiors design. Besides that, this bar is the worst bar I ever been to, there's not many liquor choices nor good music, they're cost per drink is round $16-$18. Waiters that work there wasn't very friendly, also they charge a ""service fee"" if you wanna sit down in certain area, I mean come on it's a bar not clubs. there's tons of good bars in city I would encourage you to go to this one if you trying to have so fun.","9/25/2018"
"Outstanding views. Need reservations for any of the nearby restaurants. Recommend Cecconi's on the water with again fantastic view of the Brooklyn bridge, the city and water/boats going by. Don't expect to sleep well (why I didn't give it 5 stars). Very loud, noises heard from inside the hotel as well as the boats coming in and their horns. Staff is impressively nice. Hotel rooms are very nice, showers, excellent. I would recommend staying for one night for the experience.","6/30/2018"
"trust me. william vale has much better service, view, and quality than this hotel. if i could i will give a -5 stars for this hotel. DO NOT GO!!!!","11/11/2017"
"Nice place and best service in front desk and water view ! Nice place and best service in front desk and water view ! Yes","6/10/2018"
"This place has the best view to the city! It is stylish & fresh. The drinks were very good, go on the sangria. Don't miss it & the pics you can get there!!","8/7/2018"
"Seriously, if i had a dollar for every man-bun faux hipster in the lobby and bar area i would be a zillionaire. PLUS the rude staff manning the door to the bar acting like it was just way too too much trouble when we asked where the ladies room was... THEN to top it off, take the ELEVATOR down to the UNISEX BATHROOM? WTH? IF I WANTED TO PEE WITH MEN I WOULDVE STAYED HOME WITH MY FAMILY. SORRY, BUT SO NOT A TREND TO FOLLOW. ONLY nice staff was barman who constantly asked if we needed anything...Unless you feel the need to be around overpaid, overpriced millennial, who i am guessing is the target clientele...catch an Uber and go elsewhere........","7/17/2018"
"I had the greatest time ever at this hotel! The staff was patient, always attentive and never failed to make my girlfriend and I feel like we were at home. Everything from the neighborhood to the eco-friendly aesthetic made this an unforgettable stay. Amazing food and drink menu as well! A truly one of a kind experience that I will recommend to all of my friends!","3/16/2017"
"The Rooftop bar was our reason for visiting.  Amazing view.  Our waitress wasn't the best but Gabriel stepped in and picked up the slack.  We had a cheeseburger and lobster roll.  Burger was A+. Lobster roll was good.  Pretzel was amazing.  Beer and wine were great.  The view is absolutely unbelievable.  Manhattan, the Brooklyn bridge the river.  All amazing.  I recommend you find this place and check it out.  Saw the hotels rooftop pool as well.  Wasn't a guest so couldn't go in but looked pretty cool with a view of lady liberty and south manhattan as well as the bridge.  Which reminds me the front desk staff were slightly rude I think cause I wasn't a hotel guest but they sent us all the way around the building outside when we could have just walked through a door.  They still couldn't dent the 5 stars though.  Thanks Gabriel.  You da man.","6/26/2018"
"Came out with my husband for my birthday, stayed Dec 20-24 . It was our first time in NY . Views were AMAZING . Some staff was friendly not all. We didn't get offered their complimentary car like most couples who were checking in @ the same time as us. Our last day here we requested a late checkout , when the cleaning lady came we told her we requested a late checkout and she kept coming back even though we had given her the time we were supposed to be leaving & we just felt so rushed. Anyway we finally checked out but left our bags there bc our flight was later. When we got back my husband realized he left his Gucci slides in the room . When he inquired if he could go get them, one guy immediately said "" I'll go check for you "" came back and said they weren't there. So then my husband insisted to let him go up there and they were gone. We checked all our luggage and they weren't in there. We also checked with security and they said no1 turned anything in . So how did they "" mysteriously "" disappear. A- it was housekeeping B- it was the first guy that went to check and probably moved them out of there. Either way whoever it was , was very unethical. So sad too because it's Christmas time. Amazing views don't make up for theft.","12/24/2018"
"Easily my favorite among all the hotels I've stayed at this year.  Modern design. Rooms are spacious, extremely clean, and artistic.  In-room dining, and affiliated cafes and restaurants are delicious and reasonably priced. Close to a lot of restaurants in town if you are willing to walk for 7-8 minutes. I am a huge fan of this hotel, and will recommend it to anyone who is visiting Brooklyn/NYC.","12/20/2017"
"I waited from 5:30:6:45 last evening in line to gain access to the rooftop terrace/bar. The view is spectacular. Really amazing. I noticed several parties coming up to the rope and being allowed in. When I inquired about reservations I was told,they must be made online. No such portal is on the website. I observed a roped off reserved seating area and inquired about it and was told reservations only and there's a minimum spend. But the person couldn't explain any further. Just said I had  to go online. So I called  and was given an email address for Ian. I sent message early this morning. It's now 7:50 PM and I haven't heard anything yet. When I called and asked for him I was told he was not accessible by phone. Only email. OK, but I just wish he would kindly respond to my email questions. I do intend to be bringing several friends real soon, maybe even planning a larger group, but I have no idea what to tell people about pricing/minimum spend requirements. I do think it would improve customer relations if such information was readily available.  I do understand their desire to keep,it exclusive. OK, but don't keep information secret. I do intend to go and treat myself to a night there in the near future.","8/6/2017"
"They don't care about guests, bartenders don't know how to make a margarita, they are arrogant, the waiter came to take the order at the table with the hands in his pockets! They should hire better employees!! That's all!","10/2/2017"
"The view at the hotels rooftop lounge is unlike any other.... The drinks are were not good and very watery by the time the server had brought them over, but the food was very good! The service at the rooftop is also decent but not great! The prices for drinks and food were considerably very low. In the $10-$25 range for food and $10-$16 for drinks. That being said, it makes zero sense that they would require a $100 per person order minimum to sit on a particular side of the rooftop!! Your drinks are too u set priced for one person to have a $100 minimum. Let's say you order they're amazing burger at $25 and a $15 cocktail, you have to leave smashed in order to sit on the desirable side. If the drinks were $18-$25 a piece and apps started at a higher price point, this would make sense. The other side only requiring $50 per person was far more reasonable. But like I said, the drinks were not great (coming from a nyc bartender of 10 years), the service was not good but the food was pretty good.","7/5/2019"
"One of the best hotels I have stayed in.  The lobby is gorgeous.  We stayed in a king bridge view, and there is not a better view of the city.  The bar offers amazing views with great drinks.  Tad on the expensive side but not out of the ordinary for a nyc hotel bar.  The bed was extremely comfortable.  The bathroom was gorgeous, however, two minor issues.  The shower is very small (because of the bath tub) and the toilet is awkwardly positioned.  The staff are amazing.  The food as the restaurant was also delicious with great views of the park.","12/23/2017"
"Recently a friend and I were walking across the Brooklyn bridge when the sign for the rooftop bar of the 1 Hotel caught our eye. We eventually took the trip back once the weather warmed up so we could take advantage of the rooftop. When you're up on the roof, the views are incredible! You're able to see down from the New York harbor all the way up Manhattan. Drink prices aren't unreasonable for a rooftop bar compared to most places in the city, although we did end up ordering food, which was more expensive than we wanted for a burger and fries. If you're in the DUMBO area, the 1 Hotel is definitely worth checking out to grab drinks and sit outside!","6/7/2018"
"I've actually never been to the hotel but I had to interact with staff members today. Our company rented meeting space for an Offsite. I had a bottle of champagne delivered to the hotel on behalf of someone to one of the attendees for their birthday. When I called the concierge desk to confirm it was delivered, Jonathan went above and beyond to assure that it was received by the guest. He was very professional and nice. I can say the same about everyone I spoke with. From this experience I will definitely stop by to at least have drinks. Great customer service is hard to come by. When I receive it, I'm always very appreciative.","4/6/2018"
"TERRIBLE PLACE THEY DONT EVEN DESERVE 1 STAR. 7/30 late afternoon, my friend and I went to the roof top for a complimentary drink and we received the most horrible service. The waitresses were very rude! They gave us attitude when they talked to us, they gave us dirty looks and tried avoiding us when wanted to purchase a meal. Then when I requested my bill they took 20min with my card & that made me feel very uneasy. When ever I would look back to see what's taking so long the waitress would just stare back from the bar and give me a dirty look. So be aware when they take your card. Who knows what they did to mines, I requested a new card right after that because I don't trust those people at all. It doesn't take that long to swipe a card! And they weren't even busy which was making it more suspicious. When me & my friend were about to leave we asked where the bathroom was and one of the guys showed us the way (they were in all blackish grayish suits I believe they were the guards). When we got to the bathroom we told him thank you and figured he would let us be. HE WENT INTO THE BATHROOM WITH US. His excuse was ""this place is unisex"". That still doesn't give him the right to be in there with us making us feel uncomfortable, let alone we are minors! We went to the corner of the bathroom and he moved between the mirrors where he could see us. HE WAS WATCHING US USE THE BATHROOM. I can't believe that this ""4.5star"" hotel has that kind of sick people working there. When we were leaving he followed us into the elevator and he kept on getting closer to us (the elevators are pretty big too) & he asked for our personal information! SICK AND UNPROFESSIONAL. Then he continued to try and talk to us and followed us on our way out of the hotel, he didn't stop until we got onto the street. PLEASE BE AWARE OF THIS. I don't want anything bad happening to any of you. This place does not deserve anyone's money and it surely doesn't deserve 4.5stars. Very unprofessional, I did not feel welcomed, I DID NOT FEEL SAFE here at all.","7/30/2018"
"Ok, this is one of the BEST hotel experiences I've ever had! I'm VERY picky when it comes to hotels, and this one deserves 6 stars if I could! We stayed in a skyline suite (room 504), for 2 nights, arriving on 3/13/2017 (during the expected blizzard). Our room was amazing, the size, the amenities, the view, the BED, the bathroom! When I go to Vegas I stay at the Encore in case you're wondering how picky I am.  The staff was incredibly friendly, and very accommodating! Yes, it's pricey, but it's actually worth the price! We watched a movie in the viewing room, they made homemade hot chocolate, have fresh fruit by the elevator, a free local ride in a Tesla! I could go on and on! The only down side was the service at the little cafe, the staff there were not very organized, made mistakes and forgot things and I had to find my completed order at different ends of the counter---on both visits (EXCEPT for an awesome young man with dark curly hair who helped us above and beyond on 3/14/17 in the AM, wish I knew his name to give him credit!). However, even with this one problem area, I still would give them a rating of 6 stars, and I am hard to impress! Try them for yourself!","3/15/2017"
"We came here with no expectations. Managers Andie and Lynn made us feel like royalty. We are from  this south and understand hospitality. Brooklyn and 1 Hotel rocks!!  Thank you!!","10/18/2017"
"5 star rooftop bar ***** Great ambience and amazing views of Manhattan skyline! Definitely a great place to visit during the summer","10/17/2017"
"A truly wonderful new hotel! Staff is friendly, great views, great location. Can't wait for the restaurant to open in a few weeks.  The design is modern, tasteful, and not overdone.","2/26/2017"
"If you're looking for an amazing hotel to stay at in Brooklyn look no further than Hotel 1! We stayed with our kids and dog, we all had a great time. For the kids there's the park, with skating, basketball, handball & soccer, playgrounds, bikes, a carousel and the best pizza in all of NYC!! As for the dog, the largest dog run in NYC is 1 block away! Now for the hotel, the rooms we had were a one bedroom suite and a double. Both rooms were to die for! The views in both rooms were killer. The suite was a very big corner room with a couch, chairs and a hammock on one side and bed and bathroom on the other. The rooms are decorated with an earthy chic and very comfortable. The hotel is not totally finished yet but there is a bar and lounge in the lobby and a coffee shop. We ordered room service and the food and service was really good as well. It is the nicest hotel in Brooklyn by far, with the best best view and vibe.","3/7/2017"
